{
  "metadata": {
    "search_query": "site:linkedin.com/in \"CEO\" \"Germany\"",
    "search_terms": [
      "CEO",
      "Germany"
    ],
    "total_results": 5,
    "generated_at": "2025-09-21T19:48:43.736948Z",
    "extraction_version": "2.0",
    "api_calls_used": 1
  },
  "profiles": [
    {
      "name": "Andreas Eschbach",
      "profile_url": "https://linkedin.com/in/andreas-eschbach",
      "summary": "Shiftconnector® - CEO and Founder of eschbach Germany and US · Founder and CEO of a German-American software company. eschbach provides enterprise solutions to clients in the process industry, helping them improve productivity and operational excellence. \nShiftconnector® empowers manufacturing organizations. The collaboration platform is used globally by Fortune 500 companies and is available in 23 languages. · Experience: eschbach · Education: Wilhelm Büchner Hochschule · Location: Boston · 500+ connections on LinkedIn. View Andreas Eschbach’s profile on LinkedIn, a professional community of 1 billion members.",
      "current_position": "CEO and Founder of eschbach Germany and US",
      "raw_data": {
        "structured_data": {
          "current_position": "Shiftconnector® - CEO and Founder of eschbach Germany and US",
          "company": "eschbach",
          "location": "Boston",
          "snippet_location": "CEO and Founder of eschbach Germany",
          "connection_count": "500+"
        }
      }
    },
    {
      "name": "Lutz Diederichs",
      "profile_url": "https://linkedin.com/in/lutz-diederichs/en",
      "summary": "CEO BNP Paribas Germany · In a world undergoing profound change, I am committed to ensuring that we as BNP Paribas make a positive contribution.\n \nTo do so we take responsibility – within our company and beyond. Together with around 6,000 employees in Germany, we support our clients in their projects, drive the economy’s sustainable transformation, and promote a society with more social participation. We are the bank for a changing world. · Experience: BNP Paribas · Education: Rheinische Friedrich-Wilhelms-Universität Bonn · Location: Frankfurt · 500+ connections on LinkedIn. View Lutz Diederichs’ profile on LinkedIn, a professional community of 1 billion members.",
      "current_position": "CEO BNP Paribas Germany",
      "raw_data": {
        "title": "Lutz Diederichs - CEO BNP Paribas Germany | LinkedIn",
        "structured_data": {
          "current_position": "CEO BNP Paribas Germany",
          "company": "BNP Paribas",
          "location": "Frankfurt",
          "snippet_location": "CEO BNP Paribas Germany",
          "connection_count": "500+"
        }
      }
    },
    {
      "name": "Walter Kadnar",
      "profile_url": "https://nl.linkedin.com/in/walter-kadnar/en",
      "summary": "The IKEA Vision “to create a better everyday life for the many people” has never been… · Experience: IKEA · Location: Netherlands · 500+ connections on LinkedIn. View Walter Kadnar’s profile on LinkedIn, a professional community of 1 billion members.",
      "current_position": "IKEA",
      "raw_data": {
        "title": "Walter Kadnar - IKEA | LinkedIn",
        "snippet": "IKEA Germany- The winner of the 2024 Swedish Business Award for large enterprises. Swedish Chamber of Commerce, Business Sweden, and the Swedish Embassy in ...",
        "structured_data": {
          "current_position": "IKEA",
          "company": "IKEA",
          "location": "Netherlands",
          "snippet_location": "IKEA Germany",
          "connection_count": "500+"
        }
      }
    },
    {
      "name": "Lennise Germany",
      "profile_url": "https://linkedin.com/in/lennise-germany-594461a7",
      "summary": "Founder/CEO at Livy O&#39;s · Lennise Germany is the CEO of Livy O’s Culinary Service Group. From humble beginnings selling meals from the trunk the family car in 2014, under Lennise&#39;s leadership Livy O&#39;s has thrived to servicing over 2000 meals per day for charter schools &amp; rehabilitation facilities, become a preferred vendor for the USDA, performs wedding &amp; banquet catering, and was one of 16 caterers to perform at the 2021 NFL Super Bowl. \n\nAs one of the Bay Area’s most sought after caterers, Livy O’s, is not slowing down! As a chef, Lennise is routinely seen on ABC, NBC, and Fox television stations performing cooking demonstrations. As a CEO, Lennise serves as a board member of the South Tampa Chamber and a committee chair for the Minority Enterprise Program at the Tampa Bay Chamber of Commerce. She is the wife of Omar Germany, CFO of Livy O&#39;s and a mother of 6 amazing children. Lennise’s lifes motto is that she can do anything until she can’t!  · Experience: Livy O&#39;s C",
      "current_position": "Founder/CEO at Livy O's",
      "raw_data": {
        "title": "Lennise Germany - Founder/CEO at Livy O's | LinkedIn",
        "structured_data": {
          "current_position": "Founder/CEO at Livy O&#39;s",
          "company": "Livy O&#39;s C",
          "snippet_location": "Lennise Germany"
        }
      }
    },
    {
      "name": "Jonathan Germany",
      "profile_url": "https://linkedin.com/in/jonathan-germany-a377b811",
      "summary": "CEO at Germany Dental · Experience: Germany Dental · Education: University of Mississippi · Location: Brandon · 500+ connections on LinkedIn. View Jonathan Germany’s profile on LinkedIn, a professional community of 1 billion members.",
      "current_position": "CEO at Germany Dental",
      "raw_data": {
        "title": "Jonathan Germany - CEO at Germany Dental | LinkedIn",
        "structured_data": {
          "current_position": "CEO at Germany Dental",
          "company": "Germany Dental",
          "location": "Brandon",
          "snippet_location": "CEO at Germany",
          "connection_count": "500+"
        }
      }
    }
  ],
  "extraction_stats": {
    "successful_extractions": 5,
    "failed_extractions": 0,
    "duplicate_profiles_removed": 0,
    "total_profiles": 5,
    "valid_profiles": 5,
    "invalid_profiles": 0,
    "validation_errors": []
  }
}